{
  "actor": {
    "id": "ayran.fixture",
    "kind": "service",
    "version": "1.0.0"
  },
  "aggregate_id": "hyp_01J00000000000000000000001",
  "aggregate_version": 2,
  "config_hash": "sha256:eeeeeeeeeeeeeeeeeeeeeeeeeeeeeeeeeeeeeeeeeeeeeeeeeeeeeeeeeeeeeeee",
  "created_at": "2026-08-12T12:00:00Z",
  "event_hash": "sha256:5d67e5da2699c72ba1a5d025d2ee93c192d9aeed0f7bd3196542895ba9bac799",
  "event_id": "evt_01J00000000000000000000001",
  "event_type": "hypothesis.status_changed",
  "graph": "target",
  "idempotency_key": "fixture:event:2",
  "integrity": {
    "algorithm": "sha256",
    "canonicalization": "rfc8785",
    "content_hash": "sha256:5d67e5da2699c72ba1a5d025d2ee93c192d9aeed0f7bd3196542895ba9bac799",
    "excluded_fields": [
      "integrity.content_hash",
      "event_hash"
    ]
  },
  "operation_id": "op_01J00000000000000000000001",
  "payload": {
    "content_hash": "sha256:ffffffffffffffffffffffffffffffffffffffffffffffffffffffffffffffff",
    "contract_id": "hypothesis@1.0.0",
    "object_id": "hyp_01J00000000000000000000001"
  },
  "previous_event_hash": "sha256:1111111111111111111111111111111111111111111111111111111111111111",
  "provenance": [
    {
      "license_or_terms": "private-test-fixture",
      "provenance_id": "prv_01J00000000000000000000001",
      "raw_hash": "sha256:bbbbbbbbbbbbbbbbbbbbbbbbbbbbbbbbbbbbbbbbbbbbbbbbbbbbbbbbbbbbbbbb",
      "retrieved_at": "2026-08-12T12:00:00Z",
      "source_uri": "https://fixtures.ayran.dev/m0",
      "source_version": "fixture-v1",
      "transformation_lineage": []
    }
  ],
  "run_id": "run_01J00000000000000000000001",
  "schema_version": "1.0.0",
  "seq": 2,
  "source_version": "target@fixture-v1",
  "target_identity": {
    "commit": "1111111111111111111111111111111111111111",
    "scope_id": "scp_01J00000000000000000000001",
    "source_tree_hash": "sha256:dddddddddddddddddddddddddddddddddddddddddddddddddddddddddddddddd",
    "target_id": "tgt_01J00000000000000000000001"
  }
}
